{
  "all_pass": true,
  "delta_digest": "sha256:3333333333333333333333333333333333333333333333333333333333333333",
  "event": "audit-complete",
  "expected_successor_workflow_state_version": 1,
  "graph_revision": "sha256:0000000000000000000000000000000000000000000000000000000000000000",
  "predecessor_certificate_digest": null,
  "predecessor_root_digest": "sha256:1111111111111111111111111111111111111111111111111111111111111111",
  "required_gate_ids": [
    "audit-ready"
  ],
  "reset": false,
  "run_id": "run-1",
  "schema": "transition-certificate-v1",
  "source_state": "audit",
  "source_workflow_state_version": 0,
  "successor_root_digest": "sha256:2222222222222222222222222222222222222222222222222222222222222222",
  "target_state": "triage"
}
